{
  "finalTipHash": "057aaf7542605ff8210c39edd1a603232b6af9d0c129412b3a8a59aa25658d58",
  "missionId": "uas-small-ga-smoke",
  "profile": "uas-small",
  "schemaVersion": "0.1",
  "tickCount": 120,
  "ticks": [
    {
      "expected_reasons": [],
      "expected_tip_hash": "0400db3fbbaeb3693c3e22d518be9bdfb8b469e4d2d6d5b19d08007859ae186c",
      "expected_verdict": "Allow",
      "kernel_input": {
        "intent": {
          "desired_climb_mps": 0.1,
          "desired_rates_dps": [
            0.25,
            0.0,
            0.0
          ]
        },
        "state": {
          "bank_deg": 0.0,
          "frame": "NED",
          "input_age_ms": 0,
          "position_m": [
            0.0,
            0.0,
            25.0
          ],
          "soc_percent": 90.0,
          "velocity_mps": 10.0
        },
        "tick": {
          "seq": 1,
          "ts_ms": 20
        }
      },
      "tick": 1,
      "ts_ms": 20
    },
    {
      "expected_reasons": [
        "DeadlineMiss"
      ],
      "expected_tip_hash": "f52fa8013964c23990b4136f92f12d19b94a5d6f81629d917b4308c7f0c3f4f9",
      "expected_verdict": "Override",
      "kernel_input": {
        "intent": {
          "desired_climb_mps": 0.1,
          "desired_rates_dps": [
            0.25,
            0.0,
            0.0
          ]
        },
        "state": {
          "bank_deg": 0.0,
          "frame": "NED",
          "input_age_ms": 0,
          "position_m": [
            0.0,
            0.0,
            25.0
          ],
          "soc_percent": 90.0,
          "velocity_mps": 10.0
        },
        "tick": {
          "seq": 2,
          "ts_ms": 40
        }
      },
      "tick": 2,
      "ts_ms": 40
    },
    {
      "expected_reasons": [
        "DeadlineMiss"
      ],
      "expected_tip_hash": "7c688ab491005ab49f5164c4f3b81063a71738821bb19364291a1d92f48a440c",
      "expected_verdict": "Override",
      "kernel_input": {
        "intent": {
          "desired_climb_mps": 0.1,
          "desired_rates_dps": [
            0.25,
            0.0,
            0.0
          ]
        },
        "state": {
          "bank_deg": 0.0,
          "frame": "NED",
          "input_age_ms": 0,
          "position_m": [
            0.0,
            0.0,
            25.0
          ],
          "soc_percent": 90.0,
          "velocity_mps": 10.0
        },
        "tick": {
          "seq": 3,
          "ts_ms": 60
        }
      },
      "tick": 3,
      "ts_ms": 60
    },
    {
      "expected_reasons": [
        "DeadlineMiss"
      ],
      "expected_tip_hash": "e2964fc3f2826320eda55d8e31294311de4217f53eeaa20a45f617a45c48fa0f",
      "expected_verdict": "Override",
      "kernel_input": {
        "intent": {
          "desired_climb_mps": 0.1,
          "desired_rates_dps": [
            0.25,
            0.0,
            0.0
          ]
        },
        "state": {
          "bank_deg": 0.0,
          "frame": "NED",
          "input_age_ms": 0,
          "position_m": [
            0.0,
            0.0,
            25.0
          ],
          "soc_percent": 90.0,
          "velocity_mps": 10.0
        },
        "tick": {
          "seq": 4,
          "ts_ms": 80
        }
      },
      "tick": 4,
      "ts_ms": 80
    },
    {
      "expected_reasons": [
        "DeadlineMiss"
      ],
      "expected_tip_hash": "dafcd1ac20b1628bfd3375c897a8bb3db5b309ca9fa6e40ea9979a0c6a482280",
      "expected_verdict": "Override",
      "kernel_input": {
        "intent": {
          "desired_climb_mps": 0.1,
          "desired_rates_dps": [
            0.25,
            0.0,
            0.0
          ]
        },
        "state": {
          "bank_deg": 0.0,
          "frame": "NED",
          "input_age_ms": 0,
          "position_m": [
            0.0,
            0.0,
            25.0
          ],
          "soc_percent": 90.0,
          "velocity_mps": 10.0
        },
        "tick": {
          "seq": 5,
          "ts_ms": 100
        }
      },
      "tick": 5,
      "ts_ms": 100
    },
    {
      "expected_reasons": [
        "DeadlineMiss"
      ],
      "expected_tip_hash": "79261813e2cafab6b34b138f3137c289f32967d169edf789f02f998e24ad6d17",
      "expected_verdict": "Override",
      "kernel_input": {
        "intent": {
          "desired_climb_mps": 0.1,
          "desired_rates_dps": [
            0.25,
            0.0,
            0.0
          ]
        },
        "state": {
          "bank_deg": 0.0,
          "frame": "NED",
          "input_age_ms": 0,
          "position_m": [
            0.0,
            0.0,
            25.0
          ],
          "soc_percent": 90.0,
          "velocity_mps": 10.0
        },
        "tick": {
          "seq": 6,
          "ts_ms": 120
        }
      },
      "tick": 6,
      "ts_ms": 120
    },
    {
      "expected_reasons": [
        "DeadlineMiss"
      ],
      "expected_tip_hash": "59be7362cd9178a414e02ca24bc764a506309c446015678c732a7089a3e33b63",
      "expected_verdict": "Override",
      "kernel_input": {
        "intent": {
          "desired_climb_mps": 0.1,
          "desired_rates_dps": [
            0.25,
            0.0,
            0.0
          ]
        },
        "state": {
          "bank_deg": 0.0,
          "frame": "NED",
          "input_age_ms": 0,
          "position_m": [
            0.0,
            0.0,
            25.0
          ],
          "soc_percent": 90.0,
          "velocity_mps": 10.0
        },
        "tick": {
          "seq": 7,
          "ts_ms": 140
        }
      },
      "tick": 7,
      "ts_ms": 140
    },
    {
      "expected_reasons": [
        "DeadlineMiss"
      ],
      "expected_tip_hash": "4abdf31c4dd5fc30241acb6da9e3c829ceea6400e096c8731ca444917e4c0980",
      "expected_verdict": "Override",
      "kernel_input": {
        "intent": {
          "desired_climb_mps": 0.1,
          "desired_rates_dps": [
            0.25,
            0.0,
            0.0
          ]
        },
        "state": {
          "bank_deg": 0.0,
          "frame": "NED",
          "input_age_ms": 0,
          "position_m": [
            0.0,
            0.0,
            25.0
          ],
          "soc_percent": 90.0,
          "velocity_mps": 10.0
        },
        "tick": {
          "seq": 8,
          "ts_ms": 160
        }
      },
      "tick": 8,
      "ts_ms": 160
    },
    {
      "expected_reasons": [
        "DeadlineMiss"
      ],
      "expected_tip_hash": "d30d8fd4451afc3e6b55d209ee1bf210cd0dbcebd4b39e90b489a5843a52d6b9",
      "expected_verdict": "Override",
      "kernel_input": {
        "intent": {
          "desired_climb_mps": 0.1,
          "desired_rates_dps": [
            0.25,
            0.0,
            0.0
          ]
        },
        "state": {
          "bank_deg": 0.0,
          "frame": "NED",
          "input_age_ms": 0,
          "position_m": [
            0.0,
            0.0,
            25.0
          ],
          "soc_percent": 90.0,
          "velocity_mps": 10.0
        },
        "tick": {
          "seq": 9,
          "ts_ms": 180
        }
      },
      "tick": 9,
      "ts_ms": 180
    },
    {
      "expected_reasons": [
        "DeadlineMiss"
      ],
      "expected_tip_hash": "c7646ce8e806b8914fb8fc4434e761854b32c1a5424c3b694959482da600ad08",
      "expected_verdict": "Override",
      "kernel_input": {
        "intent": {
          "desired_climb_mps": 0.1,
          "desired_rates_dps": [
            0.25,
            0.0,
            0.0
          ]
        },
        "state": {
          "bank_deg": 0.0,
          "frame": "NED",
          "input_age_ms": 0,
          "position_m": [
            0.0,
            0.0,
            25.0
          ],
          "soc_percent": 90.0,
          "velocity_mps": 10.0
        },
        "tick": {
          "seq": 10,
          "ts_ms": 200
        }
      },
      "tick": 10,
      "ts_ms": 200
    },
    {
      "expected_reasons": [
        "DeadlineMiss"
      ],
      "expected_tip_hash": "1d4bfbd32d2cf2fbc98e6dc0c9b4a6cb400053930dd6b676a3b32b212af5169e",
      "expected_verdict": "Override",
      "kernel_input": {
        "intent": {
          "desired_climb_mps": 0.1,
          "desired_rates_dps": [
            0.25,
            0.0,
            0.0
          ]
        },
        "state": {
          "bank_deg": 0.0,
          "frame": "NED",
          "input_age_ms": 0,
          "position_m": [
            0.0,
            0.0,
            25.0
          ],
          "soc_percent": 90.0,
          "velocity_mps": 10.0
        },
        "tick": {
          "seq": 11,
          "ts_ms": 220
        }
      },
      "tick": 11,
      "ts_ms": 220
    },
    {
      "expected_reasons": [
        "DeadlineMiss"
      ],
      "expected_tip_hash": "3e2c1165f530a1f4cf8d2824e4541f082aa1ee03825042d8b5ecd78e73097142",
      "expected_verdict": "Override",
      "kernel_input": {
        "intent": {
          "desired_climb_mps": 0.1,
          "desired_rates_dps": [
            0.25,
            0.0,
            0.0
          ]
        },
        "state": {
          "bank_deg": 0.0,
          "frame": "NED",
          "input_age_ms": 0,
          "position_m": [
            0.0,
            0.0,
            25.0
          ],
          "soc_percent": 90.0,
          "velocity_mps": 10.0
        },
        "tick": {
          "seq": 12,
          "ts_ms": 240
        }
      },
      "tick": 12,
      "ts_ms": 240
    },
    {
      "expected_reasons": [
        "DeadlineMiss"
      ],
      "expected_tip_hash": "61f4789dc4436053638a4a606054dfbf885608169115b634b08a28f1a8d3c00e",
      "expected_verdict": "Override",
      "kernel_input": {
        "intent": {
          "desired_climb_mps": 0.1,
          "desired_rates_dps": [
            0.25,
            0.0,
            0.0
          ]
        },
        "state": {
          "bank_deg": 0.0,
          "frame": "NED",
          "input_age_ms": 0,
          "position_m": [
            0.0,
            0.0,